{
  "schema_version": "1.0.0",
  "system_id": "personnel-service-law",
  "calendar": "hijri",
  "scope": "candidate-transcription-only",
  "current_law_verified": false,
  "trust_note": "Search-index extracts are provisional leads. Compare source documents and amendment instruments before declaring the text effective or verified.",
  "date_reviewed": "2026-10-09",
  "article_number": "19",
  "versions": [
    {
      "version_id": "boe-index-19-20261009",
      "candidate_text": "يصرف للفرد العلاوات المنصوص عليها في المادتين (17،16) اثناء الاجازة والانتداب كما تصرف للملحق والمبتعث والمندوب إذا زاول نفس اختصاصه وتسقط في حالة عدم مزاولته العمل الذي خصصت العلاوة من أجله.",
      "verification_status": "needs_review",
      "effective_from": null,
      "effective_to": null,
      "source": {
        "authority": "هيئة الخبراء بمجلس الوزراء",
        "url": "https://laws.boe.gov.sa/BoeLaws/Laws/LawDetails/9b461caf-dc11-46bd-a8fd-ac74009a8724/1",
        "capture_method": "web-search-index-excerpt",
        "independently_document_compared": false,
        "source_document_sha256": null
      },
      "text_sha256": null,
      "amendment_instruments": [],
      "reviewer_approval": null
    }
  ],
  "unresolved": [
    "full-official-source-comparison",
    "as-of-effective-period",
    "later-amendment-screening"
  ]
}
